{
    "$schema": "http://json-schema.org/draft-07/schema",
    "name": "bse_basis_set_component",
    "version": "0.1",
    "url": "TODO",
    "description": "Basis Set Exchange - A component of a basis set",
    "type": "object",
    "additionalProperties": false,
    "required": [
        "molssi_bse_schema",
        "basis_set_description",
        "basis_set_elements"
    ],
    "properties":
    {
        "molssi_bse_schema": {
            "description": "Info about which schema the file follows",
            "type": "object",
            "additionalProperties": false,
            "required": [
                "schema_type",
                "schema_version"
            ],
            "properties": {
                "schema_type" : {
                    "description": "What type of BSE JSON file this is",
                    "type": "string",
                    "enum": [ "component" ]
                },
                "schema_version": {
                    "description": "Version of the BSE basis set component schema being used",
                    "type": "string"
                }
            }
        },
        "basis_set_description": {
            "description": "Brief description of the basis set",
            "type": "string"
        },
        "basis_set_notes": {
            "description": "Any notes pertaining to this basis set",
            "type": "string"
        },
        "basis_set_references": {
            "description": "Citation/Reference information for this basis set component",
            "type": "array",
            "minItems": 0,
            "uniqueItems": true,
            "items": {
                "type": "string"
            }
        },
        "basis_set_elements": {
            "description": "Data for the elements of the basis set",
            "type": "object",
            "additionalProperties": false,
            "patternProperties":   {
                "^\\d+$" : {
                    "$ref" : "#/definitions/bse_basis_data"
                }
            }
        }
    },
    "definitions": {
        "bse_electron_shell": {
            "description": "Information for a single electronic shell",
            "additionalProperties": false,
            "required": [
                "shell_function_type",
                "shell_harmonic_type",
                "shell_region",
                "shell_angular_momentum",
                "shell_exponents",
                "shell_coefficients"
            ],
            "properties": {
                "shell_function_type": {
                    "description": "Type of function for this shell",
                    "type": "string",
                    "enum": [ "gto", "sto" ]
                },
                "shell_harmonic_type": {
                    "description": "Harmonic type (spherical, cartesian)",
                    "type": "string",
                    "enum": [ "spherical", "cartesian" ]
                },
                "shell_region": {
                    "description": "The region this shell describes",
                    "type": "string",
                    "enum": [ "", "valence", "polarization", "core", "tight", "diffuse" ]
                },
                "shell_angular_momentum": {
                    "description": "Angular momentum (as an array of integers)",
                    "type": "array",
                    "minItems": 1,
                    "uniqueItems": true,
                    "items": {
                        "type": "integer",               
                        "minimum": 0
                    }
                },
                "shell_exponents": {
                    "description": "Exponents for this contracted shell",
                    "type": "array",
                    "minItems": 1,
                    "items": {
                        "type": "string"
                    }
                },
                "shell_coefficients": {
                    "description": "General contraction coefficients for this contracted shell",
                    "type": "array",
                    "minItems": 1,
                    "items": {
                        "description": "Segmented contraction coefficients",
                        "type": "array",
                        "minItems": 1,
                        "items": { "type": "string" }
                    }
                }
            }
        },
        "ecp_potential": {
            "description": "ECP potential",
            "additionalProperties": false,
            "required": [
                "potential_ecp_type",
                "potential_angular_momentum",
                "potential_r_exponents",
                "potential_gaussian_exponents",
                "potential_coefficients"
            ],
            "properties": {
                "potential_ecp_type": {
                    "description": "Type of the ECP Potential",
                    "type": "string",
                    "enum": [ "scalar", "spinorbit" ]
                },
                "potential_angular_momentum": {
                    "description": "Angular momentum (as an array of integers)",
                    "type": "array",
                    "minItems": 1,
                    "uniqueItems": true,
                    "items": {
                        "type": "integer",               
                        "minimum": 0
                    }
                },
                "potential_r_exponents": {
                    "description": "Exponents of the r term",
                    "type": "array",
                    "minItems": 1,
                    "items": {
                        "type": "integer"
                    }
                },
                "potential_gaussian_exponents": {
                    "description": "Exponents of the gaussian term",
                    "type": "array",
                    "minItems": 1,
                    "items": {
                        "type": "string"
                    }
                },
                "potential_coefficients": {
                    "description": "General contraction coefficients for this contracted shell",
                    "type": "array",
                    "minItems": 1,
                    "items": {
                        "description": "Segmented contraction coefficients",
                        "type": "array",
                        "minItems": 1,
                        "items": { "type": "string" }
                    }
                }
            }
        },
        "bse_basis_data": {
            "description": "Data for a single element or atom in the basis set",
            "type": "object",
            "additionalProperties": false,
            "properties": {
                "element_electron_shells": {
                    "description": "(Electronic) shells for this element",
                    "type": "array",
                    "minItems": 1,
                    "uniqueItems": true,
                    "items": {
                        "$ref": "#/definitions/bse_electron_shell"
                    }
                },
                "element_ecp_electrons":
                {
                    "description": "Number of electrons replaced by ECP",
                    "type": "integer",
                    "minimum": 1
                },
                "element_ecp": {
                    "description": "Effective Core Potential for this element",
                    "type": "array",
                    "minItems": 1,
                    "uniqueItems": true,
                    "items": {
                        "$ref": "#/definitions/ecp_potential"
                    }
                }
            }
        }
    }
}
