{
    "molssi_bse_schema": {
        "schema_type": "component",
        "schema_version": "0.1"
    },
    "basis_set_description": "Polarization for 6-31G split-valence basis set",
    "basis_set_references": [
        "rassolov1998a"
    ],
    "basis_set_elements": {
        "21": {
            "element_electron_shells": [
                {
                    "shell_function_type": "gto",
                    "shell_harmonic_type": "spherical",
                    "shell_region": "valence",
                    "shell_angular_momentum": [
                        3
                    ],
                    "shell_exponents": [
                        "0.8000000000E+00"
                    ],
                    "shell_coefficients": [
                        [
                            "1.0000000"
                        ]
                    ]
                }
            ]
        },
        "22": {
            "element_electron_shells": [
                {
                    "shell_function_type": "gto",
                    "shell_harmonic_type": "spherical",
                    "shell_region": "valence",
                    "shell_angular_momentum": [
                        3
                    ],
                    "shell_exponents": [
                        "0.8000000000E+00"
                    ],
                    "shell_coefficients": [
                        [
                            "1.0000000"
                        ]
                    ]
                }
            ]
        },
        "23": {
            "element_electron_shells": [
                {
                    "shell_function_type": "gto",
                    "shell_harmonic_type": "spherical",
                    "shell_region": "valence",
                    "shell_angular_momentum": [
                        3
                    ],
                    "shell_exponents": [
                        "0.8000000000E+00"
                    ],
                    "shell_coefficients": [
                        [
                            "1.0000000"
                        ]
                    ]
                }
            ]
        },
        "24": {
            "element_electron_shells": [
                {
                    "shell_function_type": "gto",
                    "shell_harmonic_type": "spherical",
                    "shell_region": "valence",
                    "shell_angular_momentum": [
                        3
                    ],
                    "shell_exponents": [
                        "0.8000000000E+00"
                    ],
                    "shell_coefficients": [
                        [
                            "1.0000000"
                        ]
                    ]
                }
            ]
        },
        "25": {
            "element_electron_shells": [
                {
                    "shell_function_type": "gto",
                    "shell_harmonic_type": "spherical",
                    "shell_region": "valence",
                    "shell_angular_momentum": [
                        3
                    ],
                    "shell_exponents": [
                        "0.8000000000E+00"
                    ],
                    "shell_coefficients": [
                        [
                            "1.0000000"
                        ]
                    ]
                }
            ]
        },
        "26": {
            "element_electron_shells": [
                {
                    "shell_function_type": "gto",
                    "shell_harmonic_type": "spherical",
                    "shell_region": "valence",
                    "shell_angular_momentum": [
                        3
                    ],
                    "shell_exponents": [
                        "0.8000000000E+00"
                    ],
                    "shell_coefficients": [
                        [
                            "1.0000000"
                        ]
                    ]
                }
            ]
        },
        "27": {
            "element_electron_shells": [
                {
                    "shell_function_type": "gto",
                    "shell_harmonic_type": "spherical",
                    "shell_region": "valence",
                    "shell_angular_momentum": [
                        3
                    ],
                    "shell_exponents": [
                        "0.8000000000E+00"
                    ],
                    "shell_coefficients": [
                        [
                            "1.0000000"
                        ]
                    ]
                }
            ]
        },
        "28": {
            "element_electron_shells": [
                {
                    "shell_function_type": "gto",
                    "shell_harmonic_type": "spherical",
                    "shell_region": "valence",
                    "shell_angular_momentum": [
                        3
                    ],
                    "shell_exponents": [
                        "0.8000000000E+00"
                    ],
                    "shell_coefficients": [
                        [
                            "1.0000000"
                        ]
                    ]
                }
            ]
        },
        "29": {
            "element_electron_shells": [
                {
                    "shell_function_type": "gto",
                    "shell_harmonic_type": "spherical",
                    "shell_region": "valence",
                    "shell_angular_momentum": [
                        3
                    ],
                    "shell_exponents": [
                        "0.8000000000E+00"
                    ],
                    "shell_coefficients": [
                        [
                            "1.0000000"
                        ]
                    ]
                }
            ]
        },
        "30": {
            "element_electron_shells": [
                {
                    "shell_function_type": "gto",
                    "shell_harmonic_type": "spherical",
                    "shell_region": "valence",
                    "shell_angular_momentum": [
                        3
                    ],
                    "shell_exponents": [
                        "0.8000000000E+00"
                    ],
                    "shell_coefficients": [
                        [
                            "1.0000000"
                        ]
                    ]
                }
            ]
        }
    }
}