{
    "molssi_bse_schema": {
        "schema_type": "component",
        "schema_version": "0.1"
    },
    "basis_set_description": "The cc-pV5Z basis set",
    "basis_set_references": [
        "woon1994a"
    ],
    "basis_set_elements": {
        "2": {
            "element_electron_shells": [
                {
                    "shell_function_type": "gto",
                    "shell_harmonic_type": "spherical",
                    "shell_region": "",
                    "shell_angular_momentum": [
                        0
                    ],
                    "shell_exponents": [
                        "1.145000E+03",
                        "1.717000E+02",
                        "3.907000E+01",
                        "1.104000E+01",
                        "3.566000E+00",
                        "1.240000E+00",
                        "4.473000E-01",
                        "1.640000E-01"
                    ],
                    "shell_coefficients": [
                        [
                            "3.590000E-04",
                            "2.771000E-03",
                            "1.425100E-02",
                            "5.556600E-02",
                            "1.620910E-01",
                            "3.321970E-01",
                            "4.196150E-01",
                            "1.861280E-01"
                        ],
                        [
                            "0.000000E+00",
                            "0.000000E+00",
                            "0.000000E+00",
                            "0.000000E+00",
                            "1.000000E+00",
                            "0.000000E+00",
                            "0.000000E+00",
                            "0.000000E+00"
                        ],
                        [
                            "0.000000E+00",
                            "0.000000E+00",
                            "0.000000E+00",
                            "0.000000E+00",
                            "0.000000E+00",
                            "1.000000E+00",
                            "0.000000E+00",
                            "0.000000E+00"
                        ],
                        [
                            "0.000000E+00",
                            "0.000000E+00",
                            "0.000000E+00",
                            "0.000000E+00",
                            "0.000000E+00",
                            "0.000000E+00",
                            "1.000000E+00",
                            "0.000000E+00"
                        ],
                        [
                            "0.000000E+00",
                            "0.000000E+00",
                            "0.000000E+00",
                            "0.000000E+00",
                            "0.000000E+00",
                            "0.000000E+00",
                            "0.000000E+00",
                            "1.000000E+00"
                        ]
                    ]
                },
                {
                    "shell_function_type": "gto",
                    "shell_harmonic_type": "spherical",
                    "shell_region": "",
                    "shell_angular_momentum": [
                        1
                    ],
                    "shell_exponents": [
                        "1.015300E+01",
                        "3.627000E+00",
                        "1.296000E+00",
                        "4.630000E-01"
                    ],
                    "shell_coefficients": [
                        [
                            "1.000000E+00",
                            "0.000000E+00",
                            "0.000000E+00",
                            "0.000000E+00"
                        ],
                        [
                            "0.000000E+00",
                            "1.000000E+00",
                            "0.000000E+00",
                            "0.000000E+00"
                        ],
                        [
                            "0.000000E+00",
                            "0.000000E+00",
                            "1.000000E+00",
                            "0.000000E+00"
                        ],
                        [
                            "0.000000E+00",
                            "0.000000E+00",
                            "0.000000E+00",
                            "1.000000E+00"
                        ]
                    ]
                },
                {
                    "shell_function_type": "gto",
                    "shell_harmonic_type": "spherical",
                    "shell_region": "",
                    "shell_angular_momentum": [
                        2
                    ],
                    "shell_exponents": [
                        "7.666000E+00",
                        "2.647000E+00",
                        "9.140000E-01"
                    ],
                    "shell_coefficients": [
                        [
                            "1.000000E+00",
                            "0.000000E+00",
                            "0.000000E+00"
                        ],
                        [
                            "0.000000E+00",
                            "1.000000E+00",
                            "0.000000E+00"
                        ],
                        [
                            "0.000000E+00",
                            "0.000000E+00",
                            "1.000000E+00"
                        ]
                    ]
                },
                {
                    "shell_function_type": "gto",
                    "shell_harmonic_type": "spherical",
                    "shell_region": "",
                    "shell_angular_momentum": [
                        3
                    ],
                    "shell_exponents": [
                        "5.411000E+00",
                        "1.707000E+00"
                    ],
                    "shell_coefficients": [
                        [
                            "1.000000E+00",
                            "0.000000E+00"
                        ],
                        [
                            "0.000000E+00",
                            "1.000000E+00"
                        ]
                    ]
                },
                {
                    "shell_function_type": "gto",
                    "shell_harmonic_type": "spherical",
                    "shell_region": "",
                    "shell_angular_momentum": [
                        4
                    ],
                    "shell_exponents": [
                        "3.430000E+00"
                    ],
                    "shell_coefficients": [
                        [
                            "1.0000000"
                        ]
                    ]
                }
            ]
        }
    }
}