{
    "molssi_bse_schema": {
        "schema_type": "component",
        "schema_version": "0.1"
    },
    "basis_set_description": "STO-2G Minimal Basis (2 functions/AO)",
    "basis_set_references": [
        "hehre1969a"
    ],
    "basis_set_elements": {
        "1": {
            "element_electron_shells": [
                {
                    "shell_function_type": "gto",
                    "shell_harmonic_type": "spherical",
                    "shell_region": "",
                    "shell_angular_momentum": [
                        0
                    ],
                    "shell_exponents": [
                        "1.309756377",
                        "0.233135974"
                    ],
                    "shell_coefficients": [
                        [
                            "0.430128498",
                            "0.678913531"
                        ]
                    ]
                }
            ]
        },
        "6": {
            "element_electron_shells": [
                {
                    "shell_function_type": "gto",
                    "shell_harmonic_type": "spherical",
                    "shell_region": "",
                    "shell_angular_momentum": [
                        0
                    ],
                    "shell_exponents": [
                        "27.38503303",
                        "4.874522052"
                    ],
                    "shell_coefficients": [
                        [
                            "0.430128498",
                            "0.678913531"
                        ]
                    ]
                },
                {
                    "shell_function_type": "gto",
                    "shell_harmonic_type": "spherical",
                    "shell_region": "",
                    "shell_angular_momentum": [
                        0,
                        1
                    ],
                    "shell_exponents": [
                        "1.136748189",
                        "0.288309360"
                    ],
                    "shell_coefficients": [
                        [
                            "0.049471769",
                            "0.963782408"
                        ],
                        [
                            "0.511540708",
                            "0.612819896"
                        ]
                    ]
                }
            ]
        },
        "7": {
            "element_electron_shells": [
                {
                    "shell_function_type": "gto",
                    "shell_harmonic_type": "spherical",
                    "shell_region": "",
                    "shell_angular_momentum": [
                        0
                    ],
                    "shell_exponents": [
                        "37.896475",
                        "6.745554"
                    ],
                    "shell_coefficients": [
                        [
                            "0.430128",
                            "0.678914"
                        ]
                    ]
                },
                {
                    "shell_function_type": "gto",
                    "shell_harmonic_type": "spherical",
                    "shell_region": "",
                    "shell_angular_momentum": [
                        0,
                        1
                    ],
                    "shell_exponents": [
                        "1.461089",
                        "0.370571"
                    ],
                    "shell_coefficients": [
                        [
                            "0.049472",
                            "0.963782"
                        ],
                        [
                            "0.511541",
                            "0.612820"
                        ]
                    ]
                }
            ]
        },
        "8": {
            "element_electron_shells": [
                {
                    "shell_function_type": "gto",
                    "shell_harmonic_type": "spherical",
                    "shell_region": "",
                    "shell_angular_momentum": [
                        0
                    ],
                    "shell_exponents": [
                        "49.980971",
                        "8.896588"
                    ],
                    "shell_coefficients": [
                        [
                            "0.430128",
                            "0.678914"
                        ]
                    ]
                },
                {
                    "shell_function_type": "gto",
                    "shell_harmonic_type": "spherical",
                    "shell_region": "",
                    "shell_angular_momentum": [
                        0,
                        1
                    ],
                    "shell_exponents": [
                        "1.945237",
                        "0.493363"
                    ],
                    "shell_coefficients": [
                        [
                            "0.049472",
                            "0.963782"
                        ],
                        [
                            "0.511541",
                            "0.612820"
                        ]
                    ]
                }
            ]
        },
        "9": {
            "element_electron_shells": [
                {
                    "shell_function_type": "gto",
                    "shell_harmonic_type": "spherical",
                    "shell_region": "",
                    "shell_angular_momentum": [
                        0
                    ],
                    "shell_exponents": [
                        "63.735202",
                        "11.344834"
                    ],
                    "shell_coefficients": [
                        [
                            "0.430128",
                            "0.678914"
                        ]
                    ]
                },
                {
                    "shell_function_type": "gto",
                    "shell_harmonic_type": "spherical",
                    "shell_region": "",
                    "shell_angular_momentum": [
                        0,
                        1
                    ],
                    "shell_exponents": [
                        "2.498548",
                        "0.633698"
                    ],
                    "shell_coefficients": [
                        [
                            "0.049472",
                            "0.963782"
                        ],
                        [
                            "0.511541",
                            "0.612820"
                        ]
                    ]
                }
            ]
        }
    }
}