{
    "molssi_bse_schema": {
        "schema_type": "component",
        "schema_version": "0.1"
    },
    "basis_set_description": "STO-3G Minimal Basis (3 functions/AO)",
    "basis_set_references": [
        "hehre1969a",
        "hehre1970a"
    ],
    "basis_set_notes": "Uses base information from hehre1969a, with molecular Slater coefficients from hehre1970a",
    "basis_set_elements": {
        "2": {
            "element_electron_shells": [
                {
                    "shell_function_type": "gto",
                    "shell_harmonic_type": "spherical",
                    "shell_region": "",
                    "shell_angular_momentum": [
                        0
                    ],
                    "shell_exponents": [
                        "6.36242139",
                        "1.15892300",
                        "0.31364979"
                    ],
                    "shell_coefficients": [
                        [
                            "0.15432897",
                            "0.53532814",
                            "0.44463454"
                        ]
                    ]
                }
            ]
        },
        "3": {
            "element_electron_shells": [
                {
                    "shell_function_type": "gto",
                    "shell_harmonic_type": "spherical",
                    "shell_region": "",
                    "shell_angular_momentum": [
                        0
                    ],
                    "shell_exponents": [
                        "16.119575",
                        "2.9362007",
                        "0.7946505"
                    ],
                    "shell_coefficients": [
                        [
                            "0.15432897",
                            "0.53532814",
                            "0.44463454"
                        ]
                    ]
                },
                {
                    "shell_function_type": "gto",
                    "shell_harmonic_type": "spherical",
                    "shell_region": "",
                    "shell_angular_momentum": [
                        0,
                        1
                    ],
                    "shell_exponents": [
                        "0.6362897",
                        "0.1478601",
                        "0.0480887"
                    ],
                    "shell_coefficients": [
                        [
                            "-0.09996723",
                            "0.39951283",
                            "0.70011547"
                        ],
                        [
                            "0.15591627",
                            "0.60768372",
                            "0.39195739"
                        ]
                    ]
                }
            ]
        },
        "4": {
            "element_electron_shells": [
                {
                    "shell_function_type": "gto",
                    "shell_harmonic_type": "spherical",
                    "shell_region": "",
                    "shell_angular_momentum": [
                        0
                    ],
                    "shell_exponents": [
                        "30.167871",
                        "5.4951153",
                        "1.4871927"
                    ],
                    "shell_coefficients": [
                        [
                            "0.15432897",
                            "0.53532814",
                            "0.44463454"
                        ]
                    ]
                },
                {
                    "shell_function_type": "gto",
                    "shell_harmonic_type": "spherical",
                    "shell_region": "",
                    "shell_angular_momentum": [
                        0,
                        1
                    ],
                    "shell_exponents": [
                        "1.3148331",
                        "0.3055389",
                        "0.0993707"
                    ],
                    "shell_coefficients": [
                        [
                            "-0.09996723",
                            "0.39951283",
                            "0.70011547"
                        ],
                        [
                            "0.15591627",
                            "0.60768372",
                            "0.39195739"
                        ]
                    ]
                }
            ]
        },
        "5": {
            "element_electron_shells": [
                {
                    "shell_function_type": "gto",
                    "shell_harmonic_type": "spherical",
                    "shell_region": "",
                    "shell_angular_momentum": [
                        0
                    ],
                    "shell_exponents": [
                        "48.791113",
                        "8.8873622",
                        "2.4052670"
                    ],
                    "shell_coefficients": [
                        [
                            "0.15432897",
                            "0.53532814",
                            "0.44463454"
                        ]
                    ]
                },
                {
                    "shell_function_type": "gto",
                    "shell_harmonic_type": "spherical",
                    "shell_region": "",
                    "shell_angular_momentum": [
                        0,
                        1
                    ],
                    "shell_exponents": [
                        "2.2369561",
                        "0.5198205",
                        "0.1690618"
                    ],
                    "shell_coefficients": [
                        [
                            "-0.09996723",
                            "0.39951283",
                            "0.70011547"
                        ],
                        [
                            "0.15591627",
                            "0.60768372",
                            "0.39195739"
                        ]
                    ]
                }
            ]
        },
        "10": {
            "element_electron_shells": [
                {
                    "shell_function_type": "gto",
                    "shell_harmonic_type": "spherical",
                    "shell_region": "",
                    "shell_angular_momentum": [
                        0
                    ],
                    "shell_exponents": [
                        "207.01561",
                        "37.708151",
                        "10.205297"
                    ],
                    "shell_coefficients": [
                        [
                            "0.15432897",
                            "0.53532814",
                            "0.44463454"
                        ]
                    ]
                },
                {
                    "shell_function_type": "gto",
                    "shell_harmonic_type": "spherical",
                    "shell_region": "",
                    "shell_angular_momentum": [
                        0,
                        1
                    ],
                    "shell_exponents": [
                        "8.2463151",
                        "1.9162662",
                        "0.6232293"
                    ],
                    "shell_coefficients": [
                        [
                            "-0.09996723",
                            "0.39951283",
                            "0.70011547"
                        ],
                        [
                            "0.15591627",
                            "0.60768372",
                            "0.39195739"
                        ]
                    ]
                }
            ]
        }
    }
}