{
    "molssi_bse_schema": {
        "schema_type": "component",
        "schema_version": "0.1"
    },
    "basis_set_description": "4-31G valence double-zeta",
    "basis_set_references": [
        "ditchfield1971a"
    ],
    "basis_set_elements": {
        "6": {
            "element_electron_shells": [
                {
                    "shell_function_type": "gto",
                    "shell_harmonic_type": "spherical",
                    "shell_region": "valence",
                    "shell_angular_momentum": [
                        0
                    ],
                    "shell_exponents": [
                        "486.96693",
                        "73.371094",
                        "16.413458",
                        "4.3449836"
                    ],
                    "shell_coefficients": [
                        [
                            "0.0177258",
                            "0.1234787",
                            "0.4338754",
                            "0.5615042"
                        ]
                    ]
                },
                {
                    "shell_function_type": "gto",
                    "shell_harmonic_type": "spherical",
                    "shell_region": "valence",
                    "shell_angular_momentum": [
                        0,
                        1
                    ],
                    "shell_exponents": [
                        "8.6735253",
                        "2.0966193",
                        "0.6046513"
                    ],
                    "shell_coefficients": [
                        [
                            "-0.1213837",
                            "-0.2273385",
                            "1.1851739"
                        ],
                        [
                            "0.0635454",
                            "0.2982678",
                            "0.7621032"
                        ]
                    ]
                },
                {
                    "shell_function_type": "gto",
                    "shell_harmonic_type": "spherical",
                    "shell_region": "valence",
                    "shell_angular_momentum": [
                        0,
                        1
                    ],
                    "shell_exponents": [
                        "0.1835578"
                    ],
                    "shell_coefficients": [
                        [
                            "1.000000"
                        ],
                        [
                            "1.000000"
                        ]
                    ]
                }
            ]
        },
        "7": {
            "element_electron_shells": [
                {
                    "shell_function_type": "gto",
                    "shell_harmonic_type": "spherical",
                    "shell_region": "valence",
                    "shell_angular_momentum": [
                        0
                    ],
                    "shell_exponents": [
                        "671.2795",
                        "101.2017",
                        "22.69997",
                        "6.040609"
                    ],
                    "shell_coefficients": [
                        [
                            "0.0175982511",
                            "0.1228462410",
                            "0.4337821410",
                            "0.5614182170"
                        ]
                    ]
                },
                {
                    "shell_function_type": "gto",
                    "shell_harmonic_type": "spherical",
                    "shell_region": "valence",
                    "shell_angular_momentum": [
                        0,
                        1
                    ],
                    "shell_exponents": [
                        "12.3935997",
                        "2.9223828",
                        "0.83252808"
                    ],
                    "shell_coefficients": [
                        [
                            "-0.1174892990",
                            "-0.2139940160",
                            "1.1745021100"
                        ],
                        [
                            "0.0640203443",
                            "0.3112025550",
                            "0.7527482390"
                        ]
                    ]
                },
                {
                    "shell_function_type": "gto",
                    "shell_harmonic_type": "spherical",
                    "shell_region": "valence",
                    "shell_angular_momentum": [
                        0,
                        1
                    ],
                    "shell_exponents": [
                        "0.2259640"
                    ],
                    "shell_coefficients": [
                        [
                            "1.000000"
                        ],
                        [
                            "1.000000"
                        ]
                    ]
                }
            ]
        },
        "8": {
            "element_electron_shells": [
                {
                    "shell_function_type": "gto",
                    "shell_harmonic_type": "spherical",
                    "shell_region": "valence",
                    "shell_angular_momentum": [
                        0
                    ],
                    "shell_exponents": [
                        "883.27286",
                        "133.12928",
                        "29.906408",
                        "7.9786772"
                    ],
                    "shell_coefficients": [
                        [
                            "0.0175506",
                            "0.1228292",
                            "0.4348836",
                            "0.5600108"
                        ]
                    ]
                },
                {
                    "shell_function_type": "gto",
                    "shell_harmonic_type": "spherical",
                    "shell_region": "valence",
                    "shell_angular_momentum": [
                        0,
                        1
                    ],
                    "shell_exponents": [
                        "16.194447",
                        "3.7800860",
                        "1.0709836"
                    ],
                    "shell_coefficients": [
                        [
                            "-0.1134010",
                            "-0.1772865",
                            "1.1504079"
                        ],
                        [
                            "0.0685453",
                            "0.3312254",
                            "0.7346079"
                        ]
                    ]
                },
                {
                    "shell_function_type": "gto",
                    "shell_harmonic_type": "spherical",
                    "shell_region": "valence",
                    "shell_angular_momentum": [
                        0,
                        1
                    ],
                    "shell_exponents": [
                        "0.2838798"
                    ],
                    "shell_coefficients": [
                        [
                            "1.000000"
                        ],
                        [
                            "1.000000"
                        ]
                    ]
                }
            ]
        },
        "9": {
            "element_electron_shells": [
                {
                    "shell_function_type": "gto",
                    "shell_harmonic_type": "spherical",
                    "shell_region": "valence",
                    "shell_angular_momentum": [
                        0
                    ],
                    "shell_exponents": [
                        "1126.163",
                        "169.7432",
                        "38.18151",
                        "10.21204"
                    ],
                    "shell_coefficients": [
                        [
                            "0.0174758",
                            "0.122523",
                            "0.434999",
                            "0.559812"
                        ]
                    ]
                },
                {
                    "shell_function_type": "gto",
                    "shell_harmonic_type": "spherical",
                    "shell_region": "valence",
                    "shell_angular_momentum": [
                        0,
                        1
                    ],
                    "shell_exponents": [
                        "21.495370",
                        "4.989778",
                        "1.403574"
                    ],
                    "shell_coefficients": [
                        [
                            "-0.111057",
                            "-0.168322",
                            "1.143626"
                        ],
                        [
                            "0.069888",
                            "0.339388",
                            "0.727959"
                        ]
                    ]
                },
                {
                    "shell_function_type": "gto",
                    "shell_harmonic_type": "spherical",
                    "shell_region": "valence",
                    "shell_angular_momentum": [
                        0,
                        1
                    ],
                    "shell_exponents": [
                        "0.3730318"
                    ],
                    "shell_coefficients": [
                        [
                            "1.000000"
                        ],
                        [
                            "1.000000"
                        ]
                    ]
                }
            ]
        }
    }
}