{
    "molssi_bse_schema": {
        "schema_type": "component",
        "schema_version": "0.1"
    },
    "basis_set_description": "1P      Polarization functions associated with 6-311G",
    "basis_set_references": [
        "curtiss1995a"
    ],
    "basis_set_elements": {
        "31": {
            "element_electron_shells": [
                {
                    "shell_function_type": "gto",
                    "shell_harmonic_type": "spherical",
                    "shell_region": "polarization",
                    "shell_angular_momentum": [
                        2
                    ],
                    "shell_exponents": [
                        "0.169000"
                    ],
                    "shell_coefficients": [
                        [
                            "1.000000"
                        ]
                    ]
                }
            ]
        },
        "32": {
            "element_electron_shells": [
                {
                    "shell_function_type": "gto",
                    "shell_harmonic_type": "spherical",
                    "shell_region": "polarization",
                    "shell_angular_momentum": [
                        2
                    ],
                    "shell_exponents": [
                        "0.228000"
                    ],
                    "shell_coefficients": [
                        [
                            "1.000000"
                        ]
                    ]
                }
            ]
        },
        "33": {
            "element_electron_shells": [
                {
                    "shell_function_type": "gto",
                    "shell_harmonic_type": "spherical",
                    "shell_region": "polarization",
                    "shell_angular_momentum": [
                        2
                    ],
                    "shell_exponents": [
                        "0.264000"
                    ],
                    "shell_coefficients": [
                        [
                            "1.000000"
                        ]
                    ]
                }
            ]
        },
        "34": {
            "element_electron_shells": [
                {
                    "shell_function_type": "gto",
                    "shell_harmonic_type": "spherical",
                    "shell_region": "polarization",
                    "shell_angular_momentum": [
                        2
                    ],
                    "shell_exponents": [
                        "0.305000"
                    ],
                    "shell_coefficients": [
                        [
                            "1.000000"
                        ]
                    ]
                }
            ]
        },
        "35": {
            "element_electron_shells": [
                {
                    "shell_function_type": "gto",
                    "shell_harmonic_type": "spherical",
                    "shell_region": "polarization",
                    "shell_angular_momentum": [
                        2
                    ],
                    "shell_exponents": [
                        "0.451000"
                    ],
                    "shell_coefficients": [
                        [
                            "1.000000"
                        ]
                    ]
                }
            ]
        },
        "36": {
            "element_electron_shells": [
                {
                    "shell_function_type": "gto",
                    "shell_harmonic_type": "spherical",
                    "shell_region": "polarization",
                    "shell_angular_momentum": [
                        2
                    ],
                    "shell_exponents": [
                        "0.395000"
                    ],
                    "shell_coefficients": [
                        [
                            "1.000000"
                        ]
                    ]
                }
            ]
        }
    }
}