{
    "molssi_bse_schema": {
        "schema_type": "component",
        "schema_version": "0.1"
    },
    "basis_set_description": "Common base shells for def2-QZV*",
    "basis_set_references": [
        "weigend2005a"
    ],
    "basis_set_elements": {
        "56": {
            "element_electron_shells": [
                {
                    "shell_function_type": "gto",
                    "shell_harmonic_type": "spherical",
                    "shell_region": "",
                    "shell_angular_momentum": [
                        0
                    ],
                    "shell_exponents": [
                        "5.7000000000",
                        "5.2043612469"
                    ],
                    "shell_coefficients": [
                        [
                            "1.3292982002",
                            "-1.7367497134"
                        ]
                    ]
                },
                {
                    "shell_function_type": "gto",
                    "shell_harmonic_type": "spherical",
                    "shell_region": "",
                    "shell_angular_momentum": [
                        0
                    ],
                    "shell_exponents": [
                        "2.1475437282"
                    ],
                    "shell_coefficients": [
                        [
                            "1.0000000"
                        ]
                    ]
                },
                {
                    "shell_function_type": "gto",
                    "shell_harmonic_type": "spherical",
                    "shell_region": "",
                    "shell_angular_momentum": [
                        0
                    ],
                    "shell_exponents": [
                        "0.41033660537"
                    ],
                    "shell_coefficients": [
                        [
                            "1.0000000"
                        ]
                    ]
                },
                {
                    "shell_function_type": "gto",
                    "shell_harmonic_type": "spherical",
                    "shell_region": "",
                    "shell_angular_momentum": [
                        0
                    ],
                    "shell_exponents": [
                        "0.18393532770"
                    ],
                    "shell_coefficients": [
                        [
                            "1.0000000"
                        ]
                    ]
                },
                {
                    "shell_function_type": "gto",
                    "shell_harmonic_type": "spherical",
                    "shell_region": "",
                    "shell_angular_momentum": [
                        0
                    ],
                    "shell_exponents": [
                        "0.72521216545E-01"
                    ],
                    "shell_coefficients": [
                        [
                            "1.0000000"
                        ]
                    ]
                },
                {
                    "shell_function_type": "gto",
                    "shell_harmonic_type": "spherical",
                    "shell_region": "",
                    "shell_angular_momentum": [
                        0
                    ],
                    "shell_exponents": [
                        "0.34526334903E-01"
                    ],
                    "shell_coefficients": [
                        [
                            "1.0000000"
                        ]
                    ]
                },
                {
                    "shell_function_type": "gto",
                    "shell_harmonic_type": "spherical",
                    "shell_region": "",
                    "shell_angular_momentum": [
                        0
                    ],
                    "shell_exponents": [
                        "0.16157891872E-01"
                    ],
                    "shell_coefficients": [
                        [
                            "1.0000000"
                        ]
                    ]
                },
                {
                    "shell_function_type": "gto",
                    "shell_harmonic_type": "spherical",
                    "shell_region": "",
                    "shell_angular_momentum": [
                        1
                    ],
                    "shell_exponents": [
                        "5.6000000000",
                        "5.1104879274",
                        "2.5006544803",
                        "0.51947995345"
                    ],
                    "shell_coefficients": [
                        [
                            "0.51385026013",
                            "-0.70529238864",
                            "0.42822329830",
                            "-0.57125984472"
                        ]
                    ]
                },
                {
                    "shell_function_type": "gto",
                    "shell_harmonic_type": "spherical",
                    "shell_region": "",
                    "shell_angular_momentum": [
                        1
                    ],
                    "shell_exponents": [
                        "0.24536994841"
                    ],
                    "shell_coefficients": [
                        [
                            "1.0000000"
                        ]
                    ]
                },
                {
                    "shell_function_type": "gto",
                    "shell_harmonic_type": "spherical",
                    "shell_region": "",
                    "shell_angular_momentum": [
                        1
                    ],
                    "shell_exponents": [
                        "0.11256056700"
                    ],
                    "shell_coefficients": [
                        [
                            "1.0000000"
                        ]
                    ]
                },
                {
                    "shell_function_type": "gto",
                    "shell_harmonic_type": "spherical",
                    "shell_region": "",
                    "shell_angular_momentum": [
                        1
                    ],
                    "shell_exponents": [
                        "0.34917622027E-01"
                    ],
                    "shell_coefficients": [
                        [
                            "1.0000000"
                        ]
                    ]
                },
                {
                    "shell_function_type": "gto",
                    "shell_harmonic_type": "spherical",
                    "shell_region": "",
                    "shell_angular_momentum": [
                        1
                    ],
                    "shell_exponents": [
                        "0.16320065666E-01"
                    ],
                    "shell_coefficients": [
                        [
                            "1.0000000"
                        ]
                    ]
                },
                {
                    "shell_function_type": "gto",
                    "shell_harmonic_type": "spherical",
                    "shell_region": "",
                    "shell_angular_momentum": [
                        2
                    ],
                    "shell_exponents": [
                        "2.7000000000",
                        "2.3460740881",
                        "0.39553542609"
                    ],
                    "shell_coefficients": [
                        [
                            ".14372069824",
                            "-.19565347309",
                            ".29963058552"
                        ]
                    ]
                },
                {
                    "shell_function_type": "gto",
                    "shell_harmonic_type": "spherical",
                    "shell_region": "",
                    "shell_angular_momentum": [
                        2
                    ],
                    "shell_exponents": [
                        "0.12967935859"
                    ],
                    "shell_coefficients": [
                        [
                            "1.0000000"
                        ]
                    ]
                },
                {
                    "shell_function_type": "gto",
                    "shell_harmonic_type": "spherical",
                    "shell_region": "",
                    "shell_angular_momentum": [
                        2
                    ],
                    "shell_exponents": [
                        "0.40463066544E-01"
                    ],
                    "shell_coefficients": [
                        [
                            "1.0000000"
                        ]
                    ]
                }
            ]
        }
    }
}
