{
    "molssi_bse_schema": {
        "schema_type": "component",
        "schema_version": "0.1"
    },
    "basis_set_description": "def2-ECP",
    "basis_set_references": [
        "leininger1996a"
    ],
    "basis_set_elements": {
        "37": {
            "element_ecp_electrons": 28,
            "element_ecp": [
                {
                    "potential_ecp_type": "scalar",
                    "potential_angular_momentum": [
                        3
                    ],
                    "potential_r_exponents": [
                        2
                    ],
                    "potential_gaussian_exponents": [
                        "3.8431140"
                    ],
                    "potential_coefficients": [
                        [
                            "-12.3169000"
                        ]
                    ]
                },
                {
                    "potential_ecp_type": "scalar",
                    "potential_angular_momentum": [
                        0
                    ],
                    "potential_r_exponents": [
                        2,
                        2,
                        2
                    ],
                    "potential_gaussian_exponents": [
                        "5.0365510",
                        "1.9708490",
                        "3.8431140"
                    ],
                    "potential_coefficients": [
                        [
                            "89.5001980",
                            "0.4937610",
                            "12.3169000"
                        ]
                    ]
                },
                {
                    "potential_ecp_type": "scalar",
                    "potential_angular_momentum": [
                        1
                    ],
                    "potential_r_exponents": [
                        2,
                        2,
                        2
                    ],
                    "potential_gaussian_exponents": [
                        "4.2583410",
                        "1.4707090",
                        "3.8431140"
                    ],
                    "potential_coefficients": [
                        [
                            "58.5689740",
                            "0.4317910",
                            "12.3169000"
                        ]
                    ]
                },
                {
                    "potential_ecp_type": "scalar",
                    "potential_angular_momentum": [
                        2
                    ],
                    "potential_r_exponents": [
                        2,
                        2,
                        2
                    ],
                    "potential_gaussian_exponents": [
                        "3.0231270",
                        "0.6503830",
                        "3.8431140"
                    ],
                    "potential_coefficients": [
                        [
                            "26.2248980",
                            "0.9628390",
                            "12.3169000"
                        ]
                    ]
                }
            ]
        },
        "55": {
            "element_ecp_electrons": 46,
            "element_ecp": [
                {
                    "potential_ecp_type": "scalar",
                    "potential_angular_momentum": [
                        3
                    ],
                    "potential_r_exponents": [
                        2
                    ],
                    "potential_gaussian_exponents": [
                        "3.1232690"
                    ],
                    "potential_coefficients": [
                        [
                            "-28.8843090"
                        ]
                    ]
                },
                {
                    "potential_ecp_type": "scalar",
                    "potential_angular_momentum": [
                        0
                    ],
                    "potential_r_exponents": [
                        2,
                        2,
                        2
                    ],
                    "potential_gaussian_exponents": [
                        "4.0797500",
                        "2.4174060",
                        "3.1232690"
                    ],
                    "potential_coefficients": [
                        [
                            "84.5477300",
                            "16.6541730",
                            "28.8843090"
                        ]
                    ]
                },
                {
                    "potential_ecp_type": "scalar",
                    "potential_angular_momentum": [
                        1
                    ],
                    "potential_r_exponents": [
                        2,
                        2,
                        2
                    ],
                    "potential_gaussian_exponents": [
                        "5.5140800",
                        "2.1603160",
                        "3.1232690"
                    ],
                    "potential_coefficients": [
                        [
                            "157.0490590",
                            "26.4233070",
                            "28.8843090"
                        ]
                    ]
                },
                {
                    "potential_ecp_type": "scalar",
                    "potential_angular_momentum": [
                        2
                    ],
                    "potential_r_exponents": [
                        2,
                        2,
                        2
                    ],
                    "potential_gaussian_exponents": [
                        "1.8074100",
                        "0.8581820",
                        "3.1232690"
                    ],
                    "potential_coefficients": [
                        [
                            "13.1727530",
                            "3.3428330",
                            "28.8843090"
                        ]
                    ]
                }
            ]
        }
    }
}